{
  "schema_version": 2,
  "id": "personal-attempt-sha256-cccccccccccccccccccccccccccccccccccccccccccccccccccccccccccccccc",
  "record_type": "attempt",
  "asset_id": "personal-asset-bbbbbbbbbbbbbbbbbbbbbbbbbbbbbbbbbbbbbbbbbbbbbbbbbbbbbbbbbbbbbbbb",
  "outcome": "failed",
  "code": "pdf_text_unreadable",
  "observed_at": "2026-08-04T00:00:00Z"
}
